{
  "id": "draugar",
  "status": "draft",
  "name": "Draugar",
  "subtitle": "L'abomination sanguine",
  "treeType": "archetype",
  "size": 16,
  "cover": "draugar-3_4-og.png",
  "placements": [
    {
      "skill": "GREFFE-001",
      "pos": {
        "x": 50,
        "y": 50.81
      }
    },
    {
      "skill": "CROSAN-001",
      "pos": {
        "x": 50,
        "y": 37.92
      },
      "linked": [
        "GREFFE-001"
      ]
    },
    {
      "skill": "CUREEX-001",
      "pos": {
        "x": 50,
        "y": 26.14
      },
      "linked": [
        "CROSAN-001"
      ]
    },
    {
      "skill": "REGENE-001",
      "pos": {
        "x": 72.44,
        "y": 31.91
      },
      "linked": [
        "CROSAN-001"
      ]
    },
    {
      "skill": "PONCTI-001",
      "pos": {
        "x": 27.56,
        "y": 31.91
      },
      "linked": [
        "CROSAN-001"
      ]
    },
    {
      "skill": "SAIGNE-001",
      "pos": {
        "x": 65.79,
        "y": 44.37
      },
      "linked": [
        "GREFFE-001"
      ]
    },
    {
      "skill": "HEMOTR-001",
      "pos": {
        "x": 83.71,
        "y": 44.42
      },
      "linked": [
        "SAIGNE-001"
      ]
    },
    {
      "skill": "DISSEC-001",
      "pos": {
        "x": 65.79,
        "y": 57.25
      },
      "linked": [
        "GREFFE-001"
      ]
    },
    {
      "skill": "CHICAM-001",
      "pos": {
        "x": 83.71,
        "y": 57.2
      },
      "linked": [
        "DISSEC-001"
      ]
    },
    {
      "skill": "MEMERR-001",
      "pos": {
        "x": 74.68,
        "y": 68.25
      },
      "linked": [
        "DISSEC-001"
      ]
    },
    {
      "skill": "LANSAN-001",
      "pos": {
        "x": 50,
        "y": 63.7
      },
      "linked": [
        "GREFFE-001"
      ]
    },
    {
      "skill": "REMANI-001",
      "pos": {
        "x": 34.21,
        "y": 57.25
      },
      "linked": [
        "GREFFE-001"
      ]
    },
    {
      "skill": "SANFRO-001",
      "pos": {
        "x": 30.5,
        "y": 70.5
      },
      "linked": [
        "REMANI-001"
      ]
    },
    {
      "skill": "APPETI-001",
      "pos": {
        "x": 19.78,
        "y": 63.15
      },
      "linked": [
        "SANFRO-001"
      ]
    },
    {
      "skill": "GREDIS-001",
      "pos": {
        "x": 34.21,
        "y": 44.37
      },
      "linked": [
        "GREFFE-001"
      ]
    },
    {
      "skill": "VISEMP-001",
      "pos": {
        "x": 17.21,
        "y": 42.37
      },
      "linked": [
        "GREDIS-001"
      ]
    }
  ]
}
