{
  "id": "prestidigitateur",
  "status": "draft",
  "name": "Prestidigitateur",
  "subtitle": "Le maître des Illusions",
  "treeType": "archetype",
  "size": 16,
  "placements": [
    {
      "skill": "PRESTI-001",
      "pos": {
        "x": 50,
        "y": 50.81
      }
    },
    {
      "skill": "ILLMIN-001",
      "pos": {
        "x": 50,
        "y": 37.92
      },
      "linked": [
        "PRESTI-001"
      ]
    },
    {
      "skill": "ILLGRA-001",
      "pos": {
        "x": 50,
        "y": 26.14
      },
      "linked": [
        "ILLMIN-001"
      ]
    },
    {
      "skill": "ILLMOR-001",
      "pos": {
        "x": 72.44,
        "y": 31.91
      },
      "linked": [
        "ILLMIN-001"
      ]
    },
    {
      "skill": "APPILL-001",
      "pos": {
        "x": 65.79,
        "y": 44.37
      },
      "linked": [
        "PRESTI-001"
      ]
    },
    {
      "skill": "FLUMYS-001",
      "pos": {
        "x": 83.71,
        "y": 44.42
      },
      "linked": [
        "APPILL-001"
      ]
    },
    {
      "skill": "OBJANI-001",
      "pos": {
        "x": 65.79,
        "y": 57.25
      },
      "linked": [
        "PRESTI-001"
      ]
    },
    {
      "skill": "SONFAN-001",
      "pos": {
        "x": 83.71,
        "y": 57.2
      },
      "linked": [
        "OBJANI-001"
      ]
    },
    {
      "skill": "DEGUIS-001",
      "pos": {
        "x": 34.21,
        "y": 44.37
      },
      "linked": [
        "PRESTI-001"
      ]
    },
    {
      "skill": "EVANOU-001",
      "pos": {
        "x": 17.21,
        "y": 42.37
      },
      "linked": [
        "DEGUIS-001"
      ]
    },
    {
      "skill": "DOUILL-001",
      "pos": {
        "x": 34.21,
        "y": 57.25
      },
      "linked": [
        "PRESTI-001"
      ]
    },
    {
      "skill": "FAUMOR-001",
      "pos": {
        "x": 19.78,
        "y": 63.15
      },
      "linked": [
        "DOUILL-001"
      ]
    }
  ]
}
