{
  "id": "physique",
  "status": "draft",
  "name": "Physique",
  "subtitle": "Le corps aguerri",
  "treeType": "domain",
  "size": 16,
  "placements": [
    {
      "skill": "MENDAN-001",
      "pos": {
        "x": 50,
        "y": 50.81
      }
    },
    {
      "skill": "POIORG-001",
      "pos": {
        "x": 50,
        "y": 37.92
      },
      "linked": [
        "MENDAN-001"
      ]
    },
    {
      "skill": "MAIARM-001",
      "pos": {
        "x": 50,
        "y": 26.14
      },
      "linked": [
        "POIORG-001"
      ]
    },
    {
      "skill": "JAUADV-001",
      "pos": {
        "x": 72.44,
        "y": 31.91
      },
      "linked": [
        "POIORG-001"
      ]
    },
    {
      "skill": "CROFER-001",
      "pos": {
        "x": 65.79,
        "y": 44.37
      },
      "linked": [
        "MENDAN-001"
      ]
    },
    {
      "skill": "RIPOST-001",
      "pos": {
        "x": 83.71,
        "y": 44.42
      },
      "linked": [
        "CROFER-001"
      ]
    },
    {
      "skill": "TENLIG-001",
      "pos": {
        "x": 65.79,
        "y": 57.25
      },
      "linked": [
        "MENDAN-001"
      ]
    },
    {
      "skill": "GARCOR-001",
      "pos": {
        "x": 83.71,
        "y": 57.2
      },
      "linked": [
        "TENLIG-001"
      ]
    },
    {
      "skill": "PROVOC-001",
      "pos": {
        "x": 74.68,
        "y": 68.25
      },
      "linked": [
        "TENLIG-001"
      ]
    },
    {
      "skill": "SECSOU-001",
      "pos": {
        "x": 50,
        "y": 63.7
      },
      "linked": [
        "MENDAN-001"
      ]
    },
    {
      "skill": "ENDURA-001",
      "pos": {
        "x": 34.21,
        "y": 57.25
      },
      "linked": [
        "MENDAN-001"
      ]
    },
    {
      "skill": "TOUFOR-001",
      "pos": {
        "x": 19.78,
        "y": 63.15
      },
      "linked": [
        "ENDURA-001"
      ]
    },
    {
      "skill": "ENTRAI-001",
      "pos": {
        "x": 30.5,
        "y": 70.5
      },
      "linked": [
        "ENDURA-001"
      ]
    },
    {
      "skill": "DEVELO-001",
      "pos": {
        "x": 20.13,
        "y": 80.97
      },
      "linked": [
        "ENTRAI-001"
      ]
    },
    {
      "skill": "ATTSUP-001",
      "pos": {
        "x": 34.21,
        "y": 44.37
      },
      "linked": [
        "MENDAN-001"
      ]
    },
    {
      "skill": "FOURBI-001",
      "pos": {
        "x": 17.21,
        "y": 42.37
      },
      "linked": [
        "ATTSUP-001"
      ]
    }
  ]
}
